<!ELEMENT Jarticle (Title,Subtitle?,Author?,Date?,link?,Section*)>
<!ELEMENT Title ANY>
<!ELEMENT Subtitle ANY>
<!ELEMENT Author ANY>
<!ATTLIST Author Institute CDATA #IMPLIED
                 Email     CDATA #IMPLIED
                 EmailImg  CDATA #IMPLIED>

<!ELEMENT link EMPTY>
<!ATTLIST link href CDATA #IMPLIED
               rel  CDATA #IMPLIED>
<!ELEMENT Section (div|Subsection*)>
<!ATTLIST Section Title CDATA #IMPLIED>

<!ELEMENT Subsection (div)>
<!ATTLIST Subsection Title CDATA #IMPLIED>
<!ELEMENT div ANY>
<!ELEMENT Text ANY>
<!ELEMENT p ANY>
<!ELEMENT ul (li+)>
<!ELEMENT ol (li+)>
<!ELEMENT dl (dt,dd)+>
<!ELEMENT li ANY>
<!ELEMENT dt ANY>
<!ELEMENT dd ANY>

<!ELEMENT pre (#PCDATA)>
<!ELEMENT quote ANY>
<!ELEMENT Figure (Caption?,img?)>
<!ATTLIST Figure Label CDATA #IMPLIED>
<!ELEMENT Table (TableHeader?,TableBody?,Caption?)>
<!ATTLIST Table  Label CDATA #IMPLIED>
<!ELEMENT TableHeader (tr)>
<!ELEMENT TableBody (tr*)>
<!ELEMENT tr (td|th)*>
<!ELEMENT td ANY>
<!ELEMENT th ANY>
<!ELEMENT Caption (#PCDATA)>
<!ELEMENT img EMPTY>
<!ATTLIST img src CDATA #REQUIRED
              alt CDATA #REQUIRED
              width CDATA #IMPLIED
              height CDATA #IMPLIED
              altwidth CDATA #IMPLIED>

<!ELEMENT applet (param*)>
<!ATTLIST applet archive CDATA #IMPLIED
                 code    CDATA #REQUIRED
                 width   CDATA #IMPLIED
                 height  CDATA #IMPLIED>
<!ELEMENT param EMPTY>
<!ATTLIST param name CDATA #REQUIRED
                value CDATA #IMPLIED>

<!ELEMENT a ANY>
<!ATTLIST a href CDATA #REQUIRED>
<!ELEMENT b ANY>
<!ELEMENT i ANY>
<!ELEMENT tt ANY>
<!ELEMENT Date ANY>