<?xml version="1.0" encoding="UTF-8" standalone="no"?>
<!DOCTYPE Jarticle SYSTEM "/xml/Jarticle.dtd">
<?xml-stylesheet type="text/xsl" href="/xml/Jarticle.xsl"?>
<Jarticle>
    <Title>オブジェクト指向プログラミング特論(Object-oriented Programming)</Title>
    <Subtitle>2014年度(更新中)</Subtitle>
    <link rel="stylesheet" href="../lecture.css"/>
    <Author Institute="佐賀大学工学系研究科" EmailImg="/images/address.gif">只木進一
    </Author>
    <Section Title="概要">
        <div>
            <p>
情報処理システムが扱い対象をデータとその操作が組となったオブジェクトとして扱うプログラミングの
枠組みをオブジェクト指向プログラミングと言う。現実の動きとの対応付けが容易であることが利点である。
それだけでなく、プログラム要素の抽象化、それによる再利用可能性など、プログラム開発の効率化にも寄与する。
            </p>
            <p>
本講義では、Javaを使ったオブジェクト指向プログラミングを、実用的なプログラムを例にとりながら講義する。
また、抽象化や再利用の効率を上げるためのデザインパターンについても論じる。
            </p>
            <p>サンプルのソースコード中の日本語ははUTF-8です。</p>
            <p>順次、2012年度版に入れ替え作業中</p>
        </div>
    </Section>
    <Section Title="内容">
        <div>
            <ul>
                <li>
                    <a href="2012/pdf.2012/Introduction.pdf">序論：講義の目的
                    </a>
                </li>
                <li>
                    <a href="2012/pdf.2012/NetBeans.pdf">NetBeansの導入</a>
<!--                    <a href="javasrc/SimplestSample/firstSample/NoClass.java">NoClass.java</a>
                    [<a href="2012/pdf.2012/Exercises/SimpleJava.pdf">課題</a>]
-->
              </li>
                <li>
                    <a href="2012/pdf.2012/SimpleJavaExample.pdf">Java入門</a>
                <li>
                    <a href="2012/pdf.2012/SimpleJavaExample2.pdf">Java入門2</a>
                    <!--
                    <a href="javasrc/SimplestSample/firstSample/WithClass.java">WithClass.java</a>
                    <a href="javasrc/SimplestSample/firstSample/Entry.java">Entry.java</a>
                    <a href="javasrc/SimplestSample/firstSample/WithClassNew.java">WithClassNew.java</a>
                    <a href="javasrc/SimplestSample/firstSample/EntryNew.java">EntryNew.java</a>
                    [<a href="2012/pdf.2012/Exercises/SimpleJava2.pdf">課題</a>]-->
</li>
                </li>
                <li>
                  <a href="2012/pdf.2012/JavaFeatures.pdf">Java活用</a>
<!--                  [<a href="2012/pdf.2012/Exercises/SimpleJava3.pdf">課題</a>]-->
                  <br/>
                  [<a href="javasrc/SimplestSample/secondSample/EntryNew.java">Entry.java</a>
                  <a href="javasrc/SimplestSample/secondSample/WithClassNew.java">WithClassNew.java</a>]<br/>
                  [<a href="javasrc/SimpestSample/thirdSample/WithAbstractEntry.java">WithAbstractEntry.java</a>
                  <a href="javasrc/SimpestSample/thirdSample/AbstractEntry.java">AbstractEntry.java</a>
                  [<a href="javasrc/SimpestSample/thirdSample/EntryOne.java">EntryOne.java</a>]
                </li>
                <li>
                    <a href="2012/pdf.2012/WhatIsOOP.pdf">オブジェクト指向の基本的考え方</a>
                </li>
                <li><a href="2012/pdf.2012/Inheritance.pdf">クラスの階層、継承</a>
                <br/>
                [<a href="javasrc/SimplestSample/universityMembers/Member.java">Member.java</a>
                 <a href="javasrc/SimplestSample/universityMembers/Student.java">Student.java</a>
                 <a href="javasrc/SimplestSample/universityMembers/Period.java">Period.java</a>]
                [<a href="javasrc/SimplestSample/thread/Runner.java">Runner.java</a>]
                </li>
                <li><a href="2012/pdf.2012/FileIO.pdf">File IO</a><br/>
                [<a href="javasrc/FileIOsamples/standardIO/IOMain.java">IOMain.java</a>
                 <a href="javasrc/FileIOSamples/FileIO/FileIOMain.java">FileIOMain.java</a>]
                </li>
                <li><a href="2012/pdf.2012/GUI1.pdf">Graphical User Interface:widgetを使う</a>
<!--                [<a href="2012/pdf.2012/Exercises/SimpleTimer.pdf">課題</a>]-->
                <br/>
 		[
		<a href="javasrc/SampleGUI/guiWithoutAction/MainFrame.java">guiWithoutAction/MainFrame.java</a>
		<a href="javasrc/SampleGUI/guiWithoutAction/MainFrame.form">guiWithoutAction/MainFrame.form</a>
		<a href="javasrc/SampleGUI/guiWithAction/MainFrame.java">guiWithAction/MainFrame.java</a>
		<a href="javasrc/SampleGUI/guiWithAction/MainFrame.form">guiWithtAction/MainFrame.form</a>
                <a href="javasrc/SampleGUI/fileChooser/FileChooserMain.java">fileChooser/FileChooserMain.java</a>
                <a href="javasrc/SampleGUI/fileChooser/FileChooserMain.form">fileChooser/FileChooserMain.form</a>
                <a href="javasrc/SampleGUI/fileChooser/FileUtil.java">fileChooser/FileUtil.java</a>
		]<br/>
                [課題コード
                <!--
                <a href="javasrc/SampleGUI/simpleTimer/Timer.java">simpleTimer/Timer.java</a>
                <a href="javasrc/SampleGUI/simpleTimer/SimpleTimer.java">simpleTimer/SimpleTimer.java</a>
                <a href="javasrc/SampleGUI/simpleTimer/SimpleTimer.form">simpleTimer/SimpleTimer.form</a>
                <a href="javasrc/SampleGUI/simpleTimer/SetTimePanel.java">simpleTimer/SetTimePanel.java</a>
                <a href="javasrc/SampleGUI/simpleTimer/SetTimePanel.form">simpleTimer/SetTimePanel.form</a>
                -->
                ]
                </li>
                <li><a href="2012/pdf.2012/GUI2.pdf">Graphical User Interface:描画する</a><br/>
                [<a href="2012/pdf.2012/Exercises/SimplePlotter.pdf">課題</a>
                (<a href="2012/pdf.2012/HintsForSimplePlotter.pdf">ヒント</a>)]
<!--                [<a href="2012/pdf.2012/Exercises/SimpleSquareDrawer.pdf">課題</a>]-->
                <br/>
                [
                <a href="javasrc/SampleGUI/shapeSamples/ShapeSamplesMain.java">shapeSamples/ShapeSamplesMain.java</a>
                <a href="javasrc/SampleGUI/shapeSamples/ShapeSamplesMain.form">shapeSamples/ShapeSamplesMain.form</a>
                <a href="javasrc/SampleGUI/shapeSamples/DrawPanel.java">shapeSamples/DrawPanel.java</a>
                <a href="javasrc/SampleGUI/shapeSamples/DrawPanel.form">shapeSamples/DrawPanel.form</a>
                <a href="javasrc/SampleGUI/simpleDrawer/SimpleDrawerMain.java">simpleDrawer/SimpleDrawerMain.java</a>
                <a href="javasrc/SampleGUI/simpleDrawer/SimpleDrawerMain.form">simpleDrawer/SimpleDrawerMain.form</a>
                <a href="javasrc/SampleGUI/simpleDrawer/DrawPanel.java">simpleDrawer/DrawPanel.java</a>
                <a href="javasrc/SampleGUI/simpleDrawer/DrawPanel.form">simpleDrawer/DrawPanel.form</a>
                ]<br/>
<!--                [課題コード
                <a href="javasrc/SampleGUI/simpleSquareDrawer/SimpleSquareDrawerMain.java"> SimpleSquareDrawerMain.java</a>
                <a href="javasrc/SampleGUI/simpleSquareDrawer/SimpleSquareDrawerMain.form"> SimpleSquareDrawerMain.form</a>
                <a href="javasrc/SampleGUI/simpleSquareDrawer/DrawPanel.java">DrawPanel.java</a>
                <a href="javasrc/SampleGUI/simpleSquareDrawer/DrawPanel.form">DrawPanel.form</a>
                <a href="javasrc/SampleGUI/simpleSquareDrawer/MyShape.java">MyShape.java</a>
                ]--></li>
                <li><a href="2012/pdf.2012/RandomWalk.pdf">例：酔歩</a></li>
                <li><a href="2012/pdf.2012/CMOV.pdf">
                例：結合写像型最適速度交通流モデルのシミュレーション</a>
                [<a href="javasrc/CMOV.tar.gz">ソースコード</a>]</li>
                <li><a href="2012/pdf.2012/SimpleRandomWalk.pdf">
                例：簡単な酔歩シミュレーション2</a>
                [<a href="javasrc/SimpleRandomWalk.tar.gz">ソースコード</a>]
                </li>
                <li><a href="2012/pdf.2012/DB.pdf">データベースの利用</a>
                [<a href="javasrc/DBSample.tar.gz">ソースコード</a>]</li>
                <li><a href="2012/pdf.2012/XML.pdf">XMLの利用</a>
                [<a href="javasrc/XMLSample.tar.gz">ソースコード</a>]</li>
                <li><a href="2012/pdf.2012/DB.pdf">データベースの利用</a>
                [<a href="javasrc/DBSample.tar.gz">ソースコード</a>]</li>
                <li><a href="2012/pdf.2012/Servlet.pdf">サーブレット</a>
                [<a href="javasrc/ServletSample.tar.gz">ソースコード</a>]</li>
                <li><a href="2012/pdf.2012/summary.pdf">まとめ</a></li>
            </ul>
        </div>
    </Section>
    <Section Title="レポート課題">
        <div>
          <ul>
            <li><a href="Reports/2010.pdf">2010年度課題</a></li>
            <li><a href="Reports/2008.pdf">2008年度課題</a></li>
          </ul>
        </div>
    </Section>
</Jarticle>
